{
  "case_id": "t2_crc_001",
  "credibility_level": "CL0",
  "evidence_of": "T2 virtual-bench CRC error handling scenario for HW-FR-003 (H-10, issue #62): the CAN bus fault injector (hw/virtual-bench/renode/can_fault_injector.py) corrupts the CRC condition of one frame on the shared medium at t = 10 ms (PSR.LEC = CRC error, ECR.REC/CEL advanced, IR.ELO raised); the real v1.0.0 firmware (off-tree driver hw/virtual-bench/firmware/can_fault.c) detects it, increments its firmware CRC error counter and raises the fault through the real cancestry_hal_raise_fault path (CANCESTRY_HAL_FAULT_MALFORMED_FRAME, the v1.0.0 normative code for a corrupted wire frame), acknowledges the error-logging interrupt and completes the scenario uncrashed. This manifest records the PENDING disposition (pass=false, CL0): no executing run of this scenario backs an evidence artifact yet.",
  "firmware": {
    "elf": "built off-tree from tag v1.0.0 with the pinned T2 toolchain image (ci/docker/Dockerfile.t2) and CANCESTRY_T2_DRIVER=can_fault (hw/virtual-bench/firmware/build_firmware.sh); supplied at run time via CANCESTRY_T2_FAULT_ELF or --elf; never committed; its sha256 is recorded at run time",
    "modification": "none; the firmware is read-only (issue #62)"
  },
  "inherited_validation_gap": "renode: Renode peripheral models (IWDG, GPIO, RTC_BKP, DWT) are scripted emulations, not vendor-validated silicon models: platform-model bugs can alter firmware-visible timing or register semantics, and this gap is inherited by every T2 evidence artifact; golden-trace correlation against vendor reference behavior and T4 bench correlation are required before any promotion.",
  "not_covered": [
    "No executed T2 run exists for this scenario: no event timestamps, no trace CSV and no ELF/bridge/injector artifact hashes are claimed by this manifest.",
    "No independent oracle exists for CRC error handling (issue #62: oracle none): the asserted properties are the firmware's counter increment and its crash-free handling. Credibility stays CL0 until a registered oracle or a golden bench capture exists.",
    "The no-corrupted-frame-to-software-queue property of HIL-CRC-001 belongs to the software boundary conformance suite (docs/qa/hil-fault-injection-report.md section 4.2); this scenario injects no frame content and derives no RX-path claim, staying inside the issue #62 scope (no scope creep).",
    "The FDCAN protocol engine, bit timing, arbitration, bit stuffing and the physical layer are not_simulated (stm32g474-cancestry.repl header): the medium projects the fault CONDITION (PSR.LEC / ECR / IR.ELO) only.",
    "Brownout / BOR physics: deferred to H-11, gated on HS-01/HS-02 and a human safety reviewer (issue #62 constraint; HwAGENTS.md rule 6).",
    "DWT CYCCNT accuracy is deliberately unexercised (bring-up finding F-27): events are captured from emulation virtual time and carry the renode TCL2 gap inherited above.",
    "T4 physical correlation: bench-pending (HwRS section 5); CL3 requires bench data and no ledger promotion is performed here."
  ],
  "oracle_id": "none",
  "pass": false,
  "pending_reason": "The T2 fault-scenario machinery (CAN fault injector, scenario bring-up cancestry-hw-fault.resc, orchestration and the off-tree CAN fault driver) is delivered by https://github.com/mfreazer/CANcestry-/issues/62 (H-10), but no executed T2 run backs this artifact yet: like the H-07 retention foundation, the first executing run is produced by hw/virtual-bench/scenarios/t2_crc_001.py on the T2 toolchain image (hw-nightly t2-virtual-bench job) and must reproduce this manifest's ledger chain deterministically - plus a second byte-identical run via --check - before any passing disposition may be claimed.",
  "provisional": true,
  "requirement_id": "HW-FR-003",
  "scenario": {
    "duration_us": 50000,
    "fault": "crc_error",
    "inject_at_us": 10000,
    "master_step_us": 100,
    "method": "virtual_bench",
    "seed": "123456789"
  },
  "schema_version": "0.1.0",
  "source_hashes": {
    "ci/docker/Dockerfile.t2": "sha256:79b533163dc4919f4cd45f9581c0a119a150b15efde6061e5747160a2c09cf85",
    "ci/docker/renode-1.16.1.pin": "sha256:091ef14d0677440408bc2436530442e4fea1690439b1827a7bd08d495c6b44f1",
    "docs/hw/tool-qualification.md": "sha256:05cf955bac35f8cc8396e53bdee090bdd04723913cdd014c895723e968ab3beb",
    "docs/hw/virtual-bench-plan.md": "sha256:073d1abd285a2c32f6d3536d955a1e1264c6621f59b5950171e6154f5e1091b9",
    "hw/virtual-bench/firmware/build_firmware.sh": "sha256:68a96f7a3ea7b50574a399c57608c4199d437f90470e3a1a3729903e6264cbbc",
    "hw/virtual-bench/firmware/can_fault.c": "sha256:3d2258044d6a9dbe727dc95da8c097559beaef4f9c09818e699cfb46c1d3508d",
    "hw/virtual-bench/firmware/startup.s": "sha256:8182c84a3c7028723006271fa0678f8c54bd0040d0476fc3ee2d93ca1e9e5606",
    "hw/virtual-bench/fmi_bridge.py": "sha256:52a542d4efd010e2848c224472c49f5ce51f21f3c574c0cec91e929bedcc637d",
    "hw/virtual-bench/renode/can_fault_injector.py": "sha256:8ca00c869199251c205609c621d0217af435c15ddd03a6ad7331d59deb392059",
    "hw/virtual-bench/renode/cancestry-hw-fault.resc": "sha256:f0d2403dcc7707740ebbd700c28374948b96865ad2d6282631ba7ad5def7d8c6",
    "hw/virtual-bench/renode/stm32g474-cancestry.repl": "sha256:88b5b87af9da8d468c9b75f94f6827271ea82e73f20915e9ed23a05bcd2b7bf0",
    "hw/virtual-bench/scenarios/t2_crc_001.py": "sha256:629e976265c8a2b648a248cc3b38ac5ac8456781fbbccb49f2f6f12931beda08",
    "hw/virtual-bench/t2_fault_common.py": "sha256:477149a02f793e801ff28102aec719c0808697d05f5d423772b9d3026ecaf19a",
    "hw/virtual-bench/test_t2_crc.py": "sha256:017239aa414b074c964f809f075f7258ebcdda1e22fd3cfd1cb95dfa06fe91c0",
    "schemas/hw/hw-t2-fault-evidence-0.1.0.schema.json": "sha256:bad738ede32c3173ed81f73f7614f90ffdfc9600e5b92901a6822044c03329d5",
    "schemas/hw/hw-traceability-0.1.0.schema.json": "sha256:5d2e23704dd7b2125b534fd85f1930cca12df40b8d321e2cc8822aac0808afeb"
  },
  "status": "pending",
  "tool_pins": {
    "can_fault_injector": "0.1.0",
    "python": ">=3.10",
    "renode": "1.16"
  },
  "trace": {
    "artifact": "build/hw/t2_crc_001_trace.csv (per-run artifact, gitignored)",
    "columns": "time_us,bus_state,fdcan1_psr,crc_error_count",
    "hashing": "sha256 of the trace CSV, measured invariants and measured tool versions recorded in build/hw/t2_crc_001.runlog.json"
  }
}
